{
  "annotations": [
    {
      "annotator": "Lars Yencken <lars@yencken.org>",
      "date": "2015-11-15",
      "duration": 20,
      "genders": "female",
      "label": "good",
      "offset": 480,
      "problems": [],
      "speakers": 1
    }
  ],
  "checksum": "c7ecffba80b294405a845ccb216faa60",
  "date": "2009-08-01",
  "language": "ukr",
  "media_urls": [
    "http://www.archive.org/download/human_rights_02_0908_librivox/human_rights_un_ukr_r90.mp3",
    "http://mirror.widelanguageindex.org/ukr/ukr-c7ecffba80b294405a845ccb216faa60.mp3"
  ],
  "source_name": "United Nations",
  "source_url": "https://librivox.org/universal-declaration-of-human-rights-by-united-nations-volume-02/",
  "title": "Universal Declaration of Human Rights"
}