{
  "checksum": "6fba79ed6e621fd5aeaaed0cfd05545f", 
  "date": "2015-03-23", 
  "language": "kor", 
  "media_urls": [
    "http://av.voanews.com/clips/VKO/2015/03/23/20150323-120000-VKO-program.mp3", 
    "http://mirror.widelanguageindex.org/kor/kor-6fba79ed6e621fd5aeaaed0cfd05545f.mp3"
  ], 
  "source_name": "VOA \ub274\uc2a4 \ud22c\ub370\uc774 - Voice of America", 
  "source_url": "http://www.voakorea.com/audio/2672561.html", 
  "title": "VOA \ub274\uc2a4 \ud22c\ub370\uc774 2\ubd80 - 3\uc6d4 23, 2015"
}