{
  "checksum": "86e30571e404651abe353aec868e2389",
  "date": "2015-03-21",
  "language": "amh",
  "media_urls": [
    "http://av.voanews.com/clips/VAM/2015/03/21/20150321-180000-VAM-program.mp3",
    "http://mirror.widelanguageindex.org/amh/amh-86e30571e404651abe353aec868e2389.mp3"
  ],
  "source_name": "ከምሽቱ ሦስት ሰዓት የአማርኛ ዜና - የአሜሪካ ድምፅ",
  "source_url": "http://amharic.voanews.com/audio/2670994.html",
  "title": "ከምሽቱ ሦስት ሰዓት የአማርኛ ዜና - ማርች 21, 2015"
}