{
  "checksum": "be78d9c871b70e859ce3e78bf0ff07da",
  "date": "2012-06-23",
  "language": "tel",
  "media_urls": [
    "http://www.thehindu.com/multimedia/archive/01131/TeluguDisasterEdit_1131647a.mp3"
  ],
  "source_name": "The Hindu: Podcasts in Telugu",
  "source_url": "http://www.thehindu.com/opinion/editorial/article3595284.ece?ref=audio",
  "title": "Disaster ahoy! [Telugu: Onchi unna vipaththu] Editorial, June 23, 2012. Translated by V.R. Subrahmanyam, presented by Srinivas Ghantasala"
}