{
  "checksum": "09ec515e8daa6e5b914df85abb3618df",
  "date": "2016-09-13",
  "language": "ron",
  "media_urls": [
    "http://feedproxy.google.com/~r/romanian/~3/pKbuaH9oKNo/romanian_160913_554224.mp3",
    "http://mirror.widelanguageindex.org/ron/ron-09ec515e8daa6e5b914df85abb3618df.mp3"
  ],
  "source_name": "SBS Romanian",
  "source_url": "http://feedproxy.google.com/~r/romanian/~3/pKbuaH9oKNo/romanian_160913_554224.mp3",
  "title": "National Stroke Week"
}