{
  "checksum": "23f767d3fd6b0cc2b499028f107c0a86",
  "date": "2016-09-14",
  "language": "mar",
  "media_urls": [
    "http://feedproxy.google.com/~r/MARPU_VOH/~3/bW7BV0qGaUw/MARPU_VOHX_20160914_4.mp3"
  ],
  "source_name": "AWR Marathi / Maharashtra / मराठी / Marāṭhī",
  "source_url": "http://feedproxy.google.com/~r/MARPU_VOH/~3/bW7BV0qGaUw/MARPU_VOHX_20160914_4.mp3",
  "title": "812) अडचणीमागे"
}