{
  "checksum": "715d6a3c2158025bcdd9cb0743256bb3",
  "date": "2016-09-16",
  "language": "swe",
  "media_urls": [
    "http://sverigesradio.se/topsy/ljudfil/5837821.mp3",
    "http://mirror.widelanguageindex.org/swe/swe-715d6a3c2158025bcdd9cb0743256bb3.mp3"
  ],
  "source_name": "Sveriges Radio - Ekot Nyheter",
  "source_url": "http://sverigesradio.se/sida/avsnitt/778892?programid=4540",
  "title": "Luncheko 20160916 12:30"
}