{
  "checksum": "ee4cf4fb066e719cafd5a8de8f755726",
  "date": "2015-03-20",
  "language": "cmn",
  "media_urls": [
    "http://feedproxy.google.com/~r/radiomandarin/~3/UAg5tH3RiQ0/mandarin_150321_399700.mp3"
  ],
  "source_name": "SBS Australia",
  "source_url": "http://feedproxy.google.com/~r/radiomandarin/~3/UAg5tH3RiQ0/mandarin_150321_399700.mp3",
  "title": "Life Magazine\uff1aFiber vs Sugar"
}