{
  "checksum": "4ee3cfff2c68ccb34cf35c42dfe37cf8",
  "date": "2015-03-18",
  "language": "por",
  "media_urls": [
    "http://rsspod.rtp.pt/podcasts/at1/1503/3463554_177030-1503161137.mp3",
    "http://mirror.widelanguageindex.org/por/por-4ee3cfff2c68ccb34cf35c42dfe37cf8.mp3"
  ],
  "source_name": "RTP: O Mundo ao Ouvido",
  "source_url": "http://rsspod.rtp.pt/podcasts/at1/1503/3463554_177030-1503161137.mp3",
  "title": "2015-03-18 07:45:00Pron√∫ncia do Norte"
}