{
  "annotations": [
    {
      "annotator": "Lars Yencken <lars@yencken.org>",
      "date": "2015-03-19",
      "duration": 20,
      "genders": "male",
      "label": "good",
      "offset": 680,
      "problems": [],
      "speakers": 1
    }
  ],
  "checksum": "c95245f0e415e18d0bd62f6acdc7d67a",
  "date": "2006-10-22",
  "language": "epo",
  "media_urls": [
    "http://www.archive.org/download/universal_declaration_librivox/human_rights_un_eo_ac.mp3"
  ],
  "source_name": "United Nations",
  "source_url": "https://librivox.org/the-universal-declaration-of-human-rights-by-the-united-nations/",
  "title": "Universal Declaration of Human Rights"
}