{
  "checksum": "d39a06330f7dc205a23caad83e6cd2c3",
  "date": "2015-03-15",
  "language": "por",
  "media_urls": [
    "http://feedproxy.google.com/~r/portuguese/~3/txZwWzOF8G4/portuguese_150315_398402.mp3"
  ],
  "source_name": "SBS Portuguese",
  "source_url": "http://feedproxy.google.com/~r/portuguese/~3/txZwWzOF8G4/portuguese_150315_398402.mp3",
  "title": "Expectativas de Felipe Massa e Felipe Nasr no GP de F\u00f3rmula Um da Austr\u00e1lia"
}