{
  "checksum": "580dffd3445cb8be8fb1a2ab7e819ece",
  "date": "2015-11-13",
  "language": "nor",
  "media_urls": [
    "http://podkast.nrk.no/fil/dagsnytt/dagsnytt_2015-11-13_652_64.MP3?stat=1"
  ],
  "source_name": "NRK - Dagsnytt",
  "source_url": "http://podkast.nrk.no/fil/dagsnytt/dagsnytt_2015-11-13_652_64.MP3?stat=1",
  "title": "13.11.2015 Dagsnytt 0700"
}