{
  "checksum": "2521759240da6147a88520696d734eb0",
  "date": "2009-08-01",
  "language": "spa",
  "media_urls": [
    "http://www.archive.org/download/human_rights_02_0908_librivox/human_rights_un_spa_mr.mp3"
  ],
  "source_name": "United Nations",
  "source_url": "https://librivox.org/universal-declaration-of-human-rights-by-united-nations-volume-02/",
  "title": "Universal Declaration of Human Rights"
}