{
  "annotations": [
    {
      "annotator": "Lars Yencken <lars@yencken.org>",
      "date": "2015-04-12",
      "duration": 20,
      "genders": "mixed",
      "label": "bad",
      "offset": 2460,
      "problems": [
        "excess loan words",
        "pauses"
      ],
      "speakers": 2
    }
  ],
  "checksum": "49ce4178fadeb9d0ba77198fbd07e837",
  "date": "2013-08-30",
  "language": "tel",
  "media_urls": [
    "http://www.teluguoneradio.com/prgramdetails/20130830_subhashini_mmm.mp3",
    "http://mirror.widelanguageindex.org/tel/tel-49ce4178fadeb9d0ba77198fbd07e837.mp3"
  ],
  "source_name": "Telugu One Radio: Subhashini",
  "source_url": "http://www.teluguoneradio.com/archivesplayer.php?q=7822&host_id=62",
  "title": "Manalo Mana Maata"
}