{
  "checksum": "93fdbe46600751ebf3a4f5afcc9b82da",
  "date": "2013-08-10",
  "language": "prs",
  "media_urls": [
    "http://media.sbs.com.au/audio/persianfarsi_130810_282054.mp3",
    "http://mirror.widelanguageindex.org/prs/prs-93fdbe46600751ebf3a4f5afcc9b82da.mp3"
  ],
  "source_name": "SBS Persian-Farsi",
  "source_url": "http://www.sbs.com.au/yourlanguage/persian-farsi/highlight/page/id/282054/t/Profile-of-a-leader-Kevin-Rudd",
  "title": "\u062a\u0627\u0631\u06cc\u062e\u0686\u0647 \u0633\u06cc\u0627\u0633\u06cc \u06cc\u06a9 \u0631\u0647\u0628\u0631: \u06a9\u0648\u06cc\u0646 \u0631\u0627\u062f"
}