{
  "checksum": "5e2cf884e52fd13b898d682200a30197",
  "date": "2016-09-09",
  "language": "tir",
  "media_urls": [
    "http://feedproxy.google.com/~r/Tigrinya/~3/eBlm3sOyo8E/tigrinya_160910_553044.mp3",
    "http://mirror.widelanguageindex.org/tir/tir-5e2cf884e52fd13b898d682200a30197.mp3"
  ],
  "source_name": "SBS Tigrinya",
  "source_url": "http://feedproxy.google.com/~r/Tigrinya/~3/eBlm3sOyo8E/tigrinya_160910_553044.mp3",
  "title": "Eid Wishes"
}