{
  "checksum": "8e5d5fcb21f53e699fa6df4758006142",
  "date": "2012-11-06",
  "language": "tam",
  "media_urls": [
    "http://downloads.bbc.co.uk/podcasts/worldservice/tnmuslims/tnmuslims_20121106-1746a.mp3",
    "http://mirror.widelanguageindex.org/tam/tam-8e5d5fcb21f53e699fa6df4758006142.mp3"
  ],
  "source_name": "Tamil Nadu Muslims",
  "source_url": "http://downloads.bbc.co.uk/podcasts/worldservice/tnmuslims/tnmuslims_20121106-1746a.mp3",
  "title": "மீனாட்சிபுரம் இன்று"
}