{
  "checksum": "b528bca4b4de117e76a10f29cb0b2527",
  "date": "2016-09-16",
  "language": "lao",
  "media_urls": [
    "http://feedproxy.google.com/~r/lao/~3/lDcF15VJQLQ/laotian_160916_555742.mp3"
  ],
  "source_name": "SBS Lao",
  "source_url": "http://feedproxy.google.com/~r/lao/~3/lDcF15VJQLQ/laotian_160916_555742.mp3",
  "title": "Hong Kong Pro-democracy Wins Stunning Victory"
}