{
  "checksum": "43153fd3263fd603df47b84bbe56305f",
  "date": "2015-04-07",
  "language": "hat",
  "media_urls": [
    "http://av.voanews.com/clips/VCR/2015/04/07/20150407-163000-VCR-program.mp3",
    "http://mirror.widelanguageindex.org/hat/hat-43153fd3263fd603df47b84bbe56305f.mp3"
  ],
  "source_name": "Pwogram mitan jounen an - Lavwadlamerik",
  "source_url": "http://www.voanouvel.com/audio/2693215.html",
  "title": "Pwogram mitan jounen an - avril 07, 2015"
}