{
  "checksum": "08a3cd7575e2737beca4fb26232ba68f",
  "date": "2016-09-16",
  "language": "pol",
  "media_urls": [
    "http://feedproxy.google.com/~r/polish/~3/BrXUJonKsz8/polish_160916_555967.mp3"
  ],
  "source_name": "SBS Polish",
  "source_url": "http://feedproxy.google.com/~r/polish/~3/BrXUJonKsz8/polish_160916_555967.mp3",
  "title": "What will Happen to the Polish Club in Ashfield?"
}