{
  "checksum": "3480653fe811feade90de16cd3db8db1",
  "date": "2015-03-22",
  "language": "fas",
  "media_urls": [
    "http://www3.nhk.or.jp/rj/podcast/mp3/20150322130100_1_persian.mp3"
  ],
  "source_name": "Persian News - NHK WORLD RADIO JAPAN",
  "source_url": "http://www3.nhk.or.jp/rj/podcast/mp3/20150322130100_1_persian.mp3",
  "title": "NHK WORLD RADIO JAPAN - Persian News at 13:01 (JST), March 22"
}